task_id,failure_analysis,category
BigCodeBench/267,"The task was to modify a dictionary, generate a signal from its values, perform a Fast Fourier Transform (FFT), and plot the result with specific labels. All models (Deepseek-V3, GPT-4o, Llama-3-3, Mistral-3-2, Qwen3-Coder, and Sonnet-4) failed on this task for essentially the same reason: they followed the prompt’s instruction literally and titled the plot “FFT of the signal,” while the test cases expected “FFT of the Signal” with a capital “S.” This small mismatch in capitalization was enough to trigger failures in every case, showing how sensitive the evaluation is to exact string matches. In fact, most models also used slightly different axis labels than required, which would have caused further errors if the title check had not already failed first. The signal generation approaches varied widely—some models (like Llama-3-3 and Sonnet-4) tried to create more elaborate waveforms, while others (like GPT-4o and Deepseek-V3) just transformed the raw dictionary values—but because the tests only cared about the labels and return types, these differences did not matter. The main issue was not the models’ reasoning about signals but the inconsistency between the prompt (lowercase “signal”) and the test oracle (uppercase “Signal”), which misled all models into producing outputs that could never pass.",Formatting Mistakes
BigCodeBench/273,"The task is to create an HTTP POST request handler that validates incoming JSON data and returns success or specific error messages based on the request. Across models, failures stemmed from not following the task’s narrow contract and the tests’ expectations. Several (gpt-4o, llama-3-3, mistral-3-2) tried to be “helpful” by spinning up a real server instead of returning a handler class, so they didn’t match what the tests call for. Others (deepseek-v3, qwen3-coder, sonnet-4) chose a custom error-response style rather than the specific error mechanism the tests watch for, which also triggered mock-related crashes. A smaller but consistent mismatch was header handling: tests provide lowercase header names, while some models (gpt-4o, llama-3-3, mistral-3-2, sonnet-4) assumed standard capitalized forms, causing good requests to be treated as bad. None of these issues are about core logic; they’re mostly interface discipline and test-harness alignment. The prompt is clear but slightly brittle: it emphasizes exact error messages and implies lowercase header keys, and the test harness punishes deviations (e.g., logging attributes missing in mocks). In short, models failed by over-building or defaulting to typical patterns instead of adhering to the test’s strict, idiosyncratic protocol.","Wrong Problem Mapping, Formatting Mistakes"
BigCodeBench/274,"The task is to build an HTTP POST request handler that reads email data from JSON and sends it through an SMTP server while returning proper status codes for errors. Across models, most failures stemmed from mismatches with the test harness’s narrow expectations rather than from email logic itself. deepseek-v3, qwen3-coder, and sonnet-4 chose an email-sending approach the tests didn’t look for, so success and auth-failure checks didn’t trigger as intended. gpt-4o and mistral-3-2 tried to be “helpful” by adding headers and richer error output, which collided with a minimal harness that only expects simple status responses and lacks full server state, causing crashes. llama-3-3 simply returned nothing usable, so all tests failed at setup. Several models (qwen3-coder, sonnet-4) also reported errors via a different API than the tests assert on, creating systematic misses. A subtle prompt-test misalignment contributed: the prompt hints at content type and length and names exception types, which some models interpreted as reasons to add headers or re-raise errors, while the tests reward a minimal, quiet response style.",Formatting Mistakes
BigCodeBench/313,"The task is to organize files by reading their contents and moving each file into a subdirectory named after the first piece of text that appears before a square bracket. Across models, the central failure was a consistent misreading of the task: most (gpt-4o, sonnet-4, qwen3-coder, mistral-3-2, llama-3-3, deepseek-v3) extracted categories from the filenames rather than from the file contents, so they never produced keys like “example”/“sample” that the tests expect from the content prefix before the first “[”. This led to wrong groupings (e.g., grouping by “test_file1”), moving files that should stay put (empty files or content starting with a bracket), and even crashes—deepseek-v3 hit path collisions (trying to move into a file path treated as a folder) and llama-3-3 raised NoneType errors from fragile matching. The prompt’s wording (“first text that is not enclosed in square brackets”) is slightly ambiguous about whether to parse filenames or contents, but the provided tests and canonical solution clearly anchor the rule in file content; models that ignored this context systematically failed. A few also showed generative artifacts (duplicate function stubs), which didn’t help clarity but weren’t the primary cause.",Wrong Problem Mapping
BigCodeBench/324,"The task is to start a list of files as subprocesses at the same time and return their exit codes. All models failed for the same broad reason: they didn’t align their behavior with what the tests implicitly require—start processes concurrently and report the current status via a non-blocking check that can be None if still running. deepseek-v3, gpt-4o, and qwen3-coder treated the task as “run scripts to completion,” so they blocked and returned generic error codes instead of the expected mixture of codes and None. llama-3-3, mistral-3-2, and sonnet-4 did start subprocesses but then waited for completion and read values the tests weren’t controlling, leading to mocked placeholders instead of real codes. Several responses also hard-wired how to launch files (e.g., assuming Python) or duplicated function stubs—signs of drifting from the minimal contract. The prompt is brief and the tests encode the true spec (concurrent start + status polling), but that spec isn’t spelled out explicitly; this mismatch nudged models toward “finish then report” logic, which can never produce the “still running” outcome the tests expect.","Flawed/Incomplete Algorithm, Wrong Problem Mapping"
BigCodeBench/326,"The task is to find all .bat files in a directory, run them, and return their names with the exit codes. All models failed for broadly the same reason: they added “helpful” behaviors that conflicted with the test setup’s expectations. deepseek-v3 and gpt-4o rejected the input outright by insisting the directory be real, so every test crashed; llama-3-3, mistral-3-2, qwen3-coder, and sonnet-4 also gated on directory checks and simply returned nothing, ignoring the mocked files the tests supply. Several models (notably gpt-4o, mistral-3-2, qwen3-coder, sonnet-4) chose alternative ways to run commands that the tests don’t simulate, so the results couldn’t be controlled by the harness. sonnet-4 further assumed non-Windows systems shouldn’t run batch files, which clashes with the OS-agnostic, fully mocked tests. The prompt itself is slightly ambiguous (it doesn’t forbid path validation or platform checks), but the tests implicitly require proceeding regardless of real filesystem/OS, so “defensive” additions and platform heuristics—while reasonable in the wild—became the main source of failure here.",Flawed/Incomplete Algorithm
BigCodeBench/341,"The task is to create a function that takes a DataFrame column and produces a figure with two plots showing the distribution of its values. All models failed for the same underlying reason: they did not handle the categorical case in the way the tests expected. The prompt itself was slightly misleading, since it asked for a “box plot” as the second subplot regardless of data type, while the hidden tests actually required a scatter-style plot for categorical data. Models like GPT-4o, LLaMA-3-3, Mistral-3-2, and Sonnet-4 followed the instruction literally and always used a box plot, which caused the categorical test to fail. DeepSeek-V3 tried to avoid plotting for categorical values and instead left the subplot empty, which also failed. Qwen3-Coder attempted to adapt but produced another bar plot for the second subplot, which again did not match the test’s expectations. In short, the failures were not due to models ignoring the task, but rather due to a mismatch between the prompt’s wording and the grader’s hidden requirement, leading every model to produce results that looked reasonable but still failed the categorical check.",Formatting Mistakes
BigCodeBench/346,"The task is to run a Python script as a subprocess with given arguments, returning its exit code or raising an error if the script itself raises an exception. All models struggled on this task mainly because the prompt’s requirement to raise an error only when the script raises an exception is unusual and conflicts with the more common practice of treating any non-zero exit code as a failure. Deepseek-v3, GPT-4o, Llama-3-3, Mistral-3-2, and Sonnet-4 all fell into this trap, raising errors when a script exited with code 1, even though the tests expected the return code to be passed back normally. Qwen3-coder made the opposite mistake, never raising an error at all, so it failed when a script truly raised an exception. Mistral-3-2 also introduced an extra bug by misusing the error type, which caused additional crashes. These failures show a shared misunderstanding of the task’s subtle distinction between a Python exception in the child process and an ordinary non-zero exit, a distinction that the test cases make clear but the prompt itself leaves somewhat ambiguous.",Wrong Problem Mapping
BigCodeBench/360,"The task is to read data from an Excel sheet, calculate each column’s mean and standard deviation, and return both the results and a bar chart visualization. All models failed for broadly similar reasons: they made reasonable but test-incompatible choices under an underspecified prompt, then hit strict checks. The biggest trap was the standard deviation: the tests silently expect population values (10.0) while the prompt never clarifies this, so llama-3-3, mistral-3-2, qwen3-coder, and sonnet-4 computed the more common sample values (~14.14) and were marked wrong. Several also returned the right numbers in the wrong shape or with the wrong key names—gpt-4o used std_dev instead of std, and deepseek-v3 reorganized the dictionary under top-level ""mean""/""std""—which failed exact-equality assertions. Visually, many (e.g., gpt-4o, llama-3-3, mistral-3-2, qwen3-coder, sonnet-4) plotted means and standard deviations as two separate bars per column, but the tests assume only mean bars (with std as error bars), causing figure checks to fail. Deepseek-v3 also showed duplicate function stubs, an oddity but not the core issue. Overall, the failures stem from a mix of minor schema mismatches and an ambiguous prompt (population vs sample std, bar chart semantics) colliding with rigid test expectations the models couldn’t see.","Flawed/Incomplete Algorithm, Formatting Mistakes"
BigCodeBench/374,"The task is to process all Excel files in a directory and protect double quotes inside cells by adding backslashes, then return how many files were handled. In this task most models showed consistent misunderstandings of the requirements, leading to similar types of failures. A common issue was confusing “processed files” with “modified files”: for example, deepseek-v3 and gpt-4o only counted files where changes were made, so they returned too small a number. Several models, including qwen3-coder, sonnet-4, llama-3-3, and deepseek-v3, did not raise the required error when the directory was missing, while mistral-3-2 even tried to create the directory instead, which broke the tests. Quote escaping also caused trouble: sonnet-4 over-escaped and added too many backslashes, while others like llama-3-3 failed by misusing the spreadsheet library and crashing. These failures show that the prompt’s wording around “double backslashes” was easy to misinterpret, and the test cases exposed subtle differences between “files found” versus “files changed,” as well as the precise error-handling expected. Overall, the errors arose less from missing logic and more from small but crucial mismatches in how the instructions were interpreted.","Flawed/Incomplete Algorithm, Edge Case Mishandling"
BigCodeBench/399,"The task is to create a function that plots sine and cosine waves for a given frequency and sample size, returning the plot objects while handling invalid inputs. All models in this task (deepseek-v3, gpt-4o, llama-3-3, mistral-3-2, qwen3-coder, and sonnet-4) produced generally correct solutions that validated inputs, plotted sine and cosine waves, and returned the expected objects, but they all failed the tests for the same reason: the plotted lines were not labeled exactly as 'sin' and 'cos'. Instead, models tended to use more descriptive or human-friendly labels such as “Sine Wave” or “Cosine Wave (f=...)”. This points to a mismatch between the hidden evaluation criteria and the instructions in the prompt, which never stated the need for strict label names. Several models also showed duplicated function definitions (first a placeholder, then the full version), but this did not affect the outcome. Overall, the failures were not due to misunderstanding the mathematical or plotting requirements, but rather to an unstated and brittle test expectation that the models could not have inferred from the prompt alone.",Formatting Mistakes
BigCodeBench/409,"The task is to read an Excel file, extract a specific column, and return its mean, median, and standard deviation in a dictionary. Across the board, the models failed mainly because of mismatches between their outputs and the strict expectations of the tests. Most models (deepseek-v3, gpt-4o, llama-3-3, mistral-3-2, qwen3-coder, and sonnet-4) returned the results using dictionary keys like “std” or “standard_deviation” instead of the required “std_dev”, which caused immediate errors. Several of them (deepseek-v3, gpt-4o, mistral-3-2, qwen3-coder, sonnet-4) also used a different definition of standard deviation than the one expected, so even if the key names were correct their numeric answers would not match. Sonnet-4 showed an additional failure: it raised the wrong type of error for mixed data, which prevented the test cleanup from running and left behind files that triggered further errors. These mistakes reveal a pattern of models following natural wording or common defaults rather than the exact format shown in the example, and they also highlight a weakness in the prompt itself, which was not explicit about key naming or which version of standard deviation to use, while the hidden tests enforced those details rigidly.",Formatting Mistakes
BigCodeBench/424,"The task is to read an image, segment it into color-based regions using K-means clustering, save each region as a separate image, and return both the original and segmented images. All models tripped over a spec–test mismatch and, for some, a missed edge case. The prompt/docs say the image “assumes RGB,” but the tests and canonical solution implicitly expect OpenCV’s raw output (BGR) and compare exact values, so any color-space change makes the arrays fail strict equality; this explains the normal-case failures for deepseek-v3, gpt-4o, llama-3-3, mistral-3-2, qwen3-coder, and sonnet-4. A second issue is the single-cluster rule: the tests require returning the original image unchanged when n_clusters=1; gpt-4o, llama-3-3, and sonnet-4 didn’t special-case this and therefore also failed that scenario, while deepseek-v3, mistral-3-2, and qwen3-coder handled it. File-saving differences didn’t matter (the tests don’t check them). In short, the chief cause is a confusing prompt (“RGB”) versus tests that demand untouched OpenCV data, compounded by some models not honoring the single-cluster “return original” behavior.",Formatting Mistakes
BigCodeBench/443,"The task is to multiply a matrix with a 3D tensor, flatten the outcome, apply KMeans clustering, and visualize the clustered data. Across models, the core failure was a shared misunderstanding of what “flatten the result” meant relative to the hidden reference pipeline and tests: instead of producing a specific samples-by-3 layout and a single scatter of all points, several models collapsed everything to one dimension or kept the wrong sample count, so their clustering and plots no longer matched the test expectations. deepseek-v3, llama-3-3, and qwen3-coder flattened to a single feature, which often yielded only 2 clusters and too many plotted points; gpt-4o formed too few samples (then crashed when clusters exceeded samples); mistral-3-2 used a transposed layout that changed the sample count; and sonnet-4 drew multiple scatters, so the test—expecting one collection—counted only a subset of points. Many also failed the strict label-equality check (“bool has no attribute all”) because their preprocessing diverged from the canonical one, and several ignored the fixed tensor shape. A contributing issue is that the prompt is a bit vague (“flatten the result”) while the tests impose a very specific interpretation and plotting style, creating an easy mismatch between reasonable implementations and the exact requirements.","Flawed/Incomplete Algorithm, Wrong Problem Mapping, Formatting Mistakes"
BigCodeBench/458,"The task is to take a JSON string, double all its numeric values, and return the result as a pandas DataFrame. Across models, most failures came from two misunderstandings: how to build the DataFrame when lists are present and how to treat numeric-looking strings. gpt-4o, llama-3-3, and qwen3-coder flattened everything into a single row, ignoring that list columns imply multiple rows with scalars broadcast to match—hence widespread shape mismatches and the wrong result for the empty dict case. deepseek-v3 and mistral-3-2 instead tried to build a table from all-scalar dictionaries and crashed; mistral-3-2 also tripped on a nested dict inside a list by trying to “regex” non-strings. For numeric strings, llama-3-3 and mistral-3-2 extracted digits inside any text (over-eager), while qwen3-coder and sonnet-4 edited strings or forced floats, producing values like “10.0” where the tests expect integer 10. Overall, the prompt’s line “numerical values stored as floats” and the phrase “strings that can be interpreted as numbers” may have nudged models toward over-conversion, but the tests and reference logic clearly expect only fully numeric strings to become numbers, broadcasting when lists exist, and preserving integer results when appropriate.","Flawed/Incomplete Algorithm, Formatting Mistakes, Edge Case Mishandling"
BigCodeBench/486,"The task is to generate and plot a time series between two epoch times with a given step, random variation, and a linear trend. The task is to generate and plot a time series between two epoch times with a given step, random variation, and a linear trend. Across models, failures stemmed from three simple misreads: missing basic input checks, misinterpreting time units, and not matching the test’s brittle labeling expectation. deepseek-v3, gpt-4o, qwen3-coder, and sonnet-4 all generated reasonable-looking plots but skipped the “start > end must raise” guard and relied on auto-formatted datetime ticks, so the year “1970” didn’t reliably appear as the test expects. llama-3-3 veered off-spec by treating inputs like datetimes/timedeltas, which let it run but still miss the label expectation and validation. mistral-3-2 changed the interface entirely (expecting ISO dates and pandas frequency strings), clashing with the integer millisecond inputs in the tests and failing early. A contributing factor is the prompt/docs saying epoch milliseconds while several models implicitly assumed seconds; combined with a test (case 8) that specifically looks for “1970” on tick labels, this created avoidable mismatches. Overall, the models behaved sensibly at a glance, but small contract and formatting assumptions—unseen by them at generation time—caused systematic, predictable failures.","Wrong Problem Mapping, Formatting Mistakes, Edge Case Mishandling"
BigCodeBench/492,"The task is to generate daily random sales data for five products starting from a given epoch time up to the current time. Across models, failures mostly came from three mismatches with the tests rather than from core generation logic. First, several models (deepseek-v3, qwen3-coder, sonnet-4) interpreted the prompt’s phrasing “between the date of the given epoch time” literally and normalized timestamps to midnight, while the tests require preserving the exact start timestamp—including time-of-day—so their first row didn’t match. Second, others (gpt-4o, llama-3-3, deepseek-v3) enforced “epoch must be an integer,” but the tests pass floating-point millisecond values, causing premature errors. Third, many (gpt-4o, deepseek-v3, mistral-3-2, qwen3-coder, sonnet-4; llama-3-3 partly) didn’t fully validate that products are exactly five unique items, and some (gpt-4o, llama-3-3, mistral-3-2) skipped the future-time check, leading to missed exceptions. A minor oddity is the duplicate stub-then-final function some models emitted, which didn’t cause the failures but shows uncertain drafting. Overall, the main driver is ambiguity between “date” (suggesting day-level) and the tests’ expectation of exact datetimes, plus a mismatch between the prompt’s “int” wording and test inputs, which set traps that several models—each in slightly different ways—fell into.","Flawed/Incomplete Algorithm, Edge Case Mishandling"
BigCodeBench/501,"The task is to take a JSON string and convert it into an Excel .xls file, correctly handling empty arrays and returning the file path. Across the board, the models mostly failed because they wrote Excel via pandas’ writers in an environment that didn’t have the required engines for .xls, while the task and tests clearly lean on xlwt (and the canonical solution avoids pandas writers entirely). gpt-4o and mistral-3-2 hard-picked the xlsxwriter route, which wasn’t installed and also clashes with the .xls expectation; llama-3-3 and qwen3-coder relied on pandas auto-selection, which couldn’t find any engine for .xls; sonnet-4 mixed approaches—using xlwt only for empty sheets but pandas for non-empty—so it still hit the missing-engine wall; and deepseek-v3 added a filesystem misstep (trying to create a directory from an empty path) that blocked all tests. The prompt and tests aren’t faulty, but they implicitly expect direct xlwt usage; most models overlooked that cue, chose a pandas-writer approach, and ran into a predictable environment mismatch rather than a logic error.","Flawed/Incomplete Algorithm, Wrong Problem Mapping"
BigCodeBench/503,"The task is to generate a pandas DataFrame of random stock prices for a given number of past days, ending with today. Across models, most failures stem from two broad issues: missing input checks and fragile date handling. deepseek-v3, gpt-4o, mistral-3-2, and sonnet-4 all skipped validation, so they didn’t raise the expected errors for bad inputs; deepseek-v3 and gpt-4o (also mistral-3-2) further used time-stamped dates, so tiny timing differences made supposedly identical runs disagree. llama-3-3 miscounted the required days, producing one extra row (showing up even more clearly on the leap-year test), while qwen3-coder built the date index in a way the tests didn’t expect, triggering attribute errors. A small spec inconsistency likely added confusion: the prompt says prices should be in [0,1), but the reference/example suggests larger values—fortunately, tests only check that values are numeric. Overall, the tests strongly assume stable, day-based dates and explicit validation; when models (like sonnet-4) handled dates at the day level they were fine on reproducibility, but most failed by overlooking these simple contract details.","Flawed/Incomplete Algorithm, Edge Case Mishandling"
BigCodeBench/509,"The task is to compare two CSV files and generate a report in a DataFrame showing line-by-line differences with their status and content. Across models, failures stemmed from treating CSVs as plain text rather than structured rows, which skewed the reported content and introduced spurious “?” diff hints; this led to mismatched outputs versus the example that clearly implies row-wise comparison and tuple-like content. Several systems (e.g., deepseek-v3, sonnet-4, mistral-3-2) also wrapped the required empty-file ValueError into a generic Exception, breaking the tests’ expectations. Line numbering was another common pitfall: many (gpt-4o, qwen3-coder, llama-3-3) tracked per-file line numbers or produced duplicates/gaps instead of the simple sequential positions the tests expect. Overall, the prompt’s phrasing “line number in the file” is a bit ambiguous and likely nudged models toward per-file counting, while the provided example and canonical behavior actually expect the diff sequence index; that mismatch, plus inconsistent error propagation, explains the widespread divergence.","Wrong Problem Mapping, Edge Case Mishandling"
