task_id,failure_analysis,category
BigCodeBench/101,"The task is to generate a Seaborn correlation heatmap of the Boston Housing dataset and return the plot object, with an option to save the figure. Across models, failures stemmed from two consistent mismatches with the task and tests: correctly parsing the Boston dataset’s unusual two-line format and restricting the heatmap to the 13 feature columns (no target) with no titles or labels. deepseek-v3, mistral-3-2, and qwen3-coder misread the file layout as a simple table, so they couldn’t even build the right data; gpt-4o got close but mislabeled the columns to include a target, which broke shapes and would also have spoiled the expected 13×13 correlations; llama-3-3 and sonnet-4 ignored the provided URL and relied on a removed external loader, so they failed early and, even if they hadn’t, they planned to include the target and add a title. Several models (e.g., deepseek-v3, gpt-4o, sonnet-4) also added plot titles or masks that conflict with the tests, which expect a full 13×13 correlation matrix and empty titles/labels. In short, small divergences from the prompt’s constraints and the tests’ strict expectations—especially the file’s structure, excluding the target, and leaving the plot unlabeled—cascaded into consistent failures across models.","Flawed/Incomplete Algorithm, Wrong Problem Mapping"
BigCodeBench/1012,"The task is to download a ZIP file from a given URL, extract its contents, and return a status message with the list of extracted files. Across models, most failures stem from not honoring the task’s strict message contract and the tests’ expectations: deepseek-v3, gpt-4o, mistral-3-2, and qwen3-coder return a generic “Success” instead of the required “Download and extraction successful,” while gpt-4o, qwen3-coder, sonnet-4, llama-3-3, and mistral-3-2 mishandle non-200 responses, producing generic errors (or unzip errors) rather than the mandated “Download failed …”. Llama-3-3 gets the success message right but still ignores the non-200 branch; mistral-3-2 also shows brittle cleanup that crashes under network errors. These behaviors suggest a common misunderstanding: treating all bad outcomes as generic exceptions instead of following the specific status messaging rules called out in the prompt and implicitly enforced by the tests. The test design (mocking only the HTTP status and not fully emulating response content/raise-for-status) intentionally pressures solutions to check status codes explicitly, exposing approaches (e.g., gpt-4o, qwen3-coder, sonnet-4) that proceed as if a normal response exists. Overall, the prompt’s phrasing requirements and the tests’ targeted assertions are clear but unforgiving; models that didn’t align their messages precisely—or that failed to separate HTTP failures from extraction errors—fell short.","Formatting Mistakes, Edge Case Mishandling"
BigCodeBench/1015,"The task is to parse an HTML table from either a webpage or local file and store its contents into an SQLite database, returning the number of rows extracted. Across submissions, most failures trace to two themes: brittle table parsing choices and mishandling of file:// inputs under the test setup. deepseek-v3, gpt-4o, llama-3-3, and mistral-3-2 all leaned on pandas’ HTML parser, which in this environment requires a newer BeautifulSoup than is installed, so they crashed on an import error rather than gracefully handling empty or simple tables. gpt-4o and llama-3-3 also treated file:///… like a web URL, triggering “no connection adapter” or file-load errors; sonnet-4 tried to detect local files but then rejected the mocked file:// path before reading it; qwen3-coder misclassified file:// as a URL and also surfaced parsing errors as database errors. Several models (qwen3-coder, sonnet-4) returned the wrong exception type, and a few included a stray stubbed function definition, hinting at rushed assembly. The prompt and tests introduce subtle traps: local files are provided only as file:// URIs, HTTP responses are mocked via the .content attribute (not .text), and the environment intentionally makes pandas’ HTML helper unreliable—so approaches that depend on those assumptions fail consistently.",Flawed/Incomplete Algorithm
BigCodeBench/1019,"The task is to extract text from an image using OCR, convert it between encodings, and if OCR fails, fall back to the image’s embedded comment. Across models, most failures stem from mishandling the task’s control flow and error policy rather than OCR itself: the prompt expects “try OCR → if nonempty convert → on conversion errors raise ValueError → else fall back to the image comment → finally return empty string,” and the tests enforce that with mocked images and comments. deepseek-v3 and llama-3-3 broadly catch/transform errors or misuse the fallback, so real encoding problems don’t surface as the required ValueError and valid comments get ignored. sonnet-4 suppresses the very ValueError the tests demand when OCR conversion is wrong, then fails to return the available comment. mistral-3-2 and qwen3-coder interact poorly with the mocked objects, so instead of real strings they bubble mock placeholders, which the assertions reject; qwen3-coder also muddles the notion of “convert from X to Y,” leading to inconsistent outputs. gpt-4o adds an unnecessary file-existence check, conflicting with the test harness that uses dummy paths, so everything aborts early. Overall, the common pattern is deviation from the specified “raise only on encoding-conversion errors, otherwise fall back or return empty,” plus fragile handling of the provided (mocked) metadata; the prompt and tests are consistent, but they assume no extra filesystem checks and precise, minimal exception behavior.",Flawed/Incomplete Algorithm
BigCodeBench/1039,"The task is to secure a client socket with SSL/TLS, receive a requested file path, and return the file’s SHA256 hash or an error message. Across models, most failures stem from small mismatches with strict tests rather than core functionality: deepseek-v3 and mistral-3-2 behaved reasonably but didn’t satisfy the test’s exact expectations for how a response must be sent and how the error text must be worded; gpt-4o also missed a required cleanup step during errors; llama-3-3 computed results but didn’t actually send a response back to the client; sonnet-4 returned clear errors yet failed to close the secure connection on exceptions; and qwen3-coder was closest to passing but lost points for the precise error string format. A recurring quirk is that several models emitted a redundant stub before the real function, hinting at generation noise. Overall, the prompt is straightforward, but the tests are unusually opinionated—they demand a specific send method, an exact error phrase, and guaranteed socket closing—so otherwise sensible approaches were marked wrong due to these tight, inflexible checks.","Flawed/Incomplete Algorithm, Formatting Mistakes, Edge Case Mishandling"
BigCodeBench/1042,"The task is to receive a message from a client socket and forward it as an email through an SMTP server. Across all models, failures largely stem from breaking the prompt’s I/O contract and clashing with the tests’ expectations: most models (deepseek-v3, llama-3-3, mistral-3-2, qwen3-coder, sonnet-4, and gpt-4o) asked for sender/recipient via input rather than getpass, which the harness doesn’t mock, causing immediate read errors and preventing any SMTP call, acknowledgment, or clean socket close; additionally, gpt-4o and sonnet-4 swallowed exceptions, so an injected SMTPConnectError never surfaced (the tests require it), and several didn’t send the required “Message sent.” response or guarantee closing the socket, leading to further assertion failures; finally, there’s a small spec/test mismatch—tests demand skipping email send on an empty message, while the provided canonical snippet doesn’t show that guard—so even near-correct approaches would still fail without that behavior.",Flawed/Incomplete Algorithm
BigCodeBench/1057,"The task is to create a pandas DataFrame showing all animal–food combinations in an ""animal:food"" format, using defaults or empty outputs depending on the inputs. All models failed for broadly the same reasons: they misread the special-case rules and used the wrong defaults. The prompt is misleading—it says returning an empty DataFrame when lists are “empty or not provided,” but the tests expect the opposite for “not provided” (use large defaults to get a 10×7 grid). Deepseek-v3, Llama-3-3, Mistral-3-2, and Qwen3-coder all treated “not provided” as empty, immediately producing empty outputs; GPT-4o and Sonnet-4 also replaced empty inputs with small ad-hoc defaults (3×3 or 5×5), so shapes never matched what the tests enforce. Several models (e.g., GPT-4o, Sonnet-4) computed shuffled combinations but didn’t actually rely on them, hinting at spec drift rather than precise requirement tracking. Sonnet-4 further showed a logic-ordering glitch that made its empty-input check ineffective, yielding the same wrong result for multiple scenarios. Across the board, the root cause is ambiguity between “None” vs [] and ignoring the exact default sizes implied by the tests; once those two points are off, every downstream assertion fails. In short, the failures reflect a prompt–test inconsistency that required prioritizing the tests, plus casual default choices by the models that guaranteed shape mismatches.",Flawed/Incomplete Algorithm
BigCodeBench/1077,"The task is to calculate the average time difference in seconds between consecutive timestamps in a list after converting them to a specified timezone. Across models, the failures mostly stem from ignoring the specified timestamp format and the task’s simple sequencing logic rather than any flaw in the prompt or tests. The docs clearly state inputs like “dd/mm/yy HH:MM:SS.fff” and ask for average absolute gaps after timezone conversion, yet gpt-4o, mistral-3-2, qwen3-coder, and sonnet-4 all assumed ISO timestamps, so they crashed on parsing; llama-3-3 also used the wrong pattern and would have produced incorrect gaps even if it had parsed; and deepseek-v3 silently skipped unparsed items, collapsing to 0.0 in every case. A few approaches (notably llama-3-3 and deepseek-v3) also conflated “assigning” a timezone with “converting” to one, which would distort results if parsing had succeeded. The test suite is coherent (including out-of-order inputs and day boundaries), and the only subtlety is that the reference treats inputs as UTC before conversion; however, this wasn’t the primary cause—the predominant issue was models overriding the stated input format and requirements.","Flawed/Incomplete Algorithm, Formatting Mistakes"
BigCodeBench/1129,"The task is to parse a JSON string, fetch a file from a URL inside it, and save the file locally with a timestamped name. The task is to parse a JSON string, fetch a file from a URL inside it, and save the file locally with a timestamped name. Overall, the models failed for predictable, test-harness reasons rather than core logic: the tests stub the network call with a very minimal mock, but several models (deepseek-v3, gpt-4o, llama-3-3, mistral-3-2, qwen3-coder, sonnet-4) added “real-world” robustness (extra HTTP checks, streaming, etc.) that the mock didn’t support, causing crashes. A second recurring mismatch was error handling: the tests implicitly require a specific missing-key exception, while deepseek-v3 and llama-3-3 converted it to a different error type, so they failed even before file writing mattered. Sonnet-4 also chose a text-saving approach, which conflicts with the test’s expectation of raw bytes. There’s nothing fundamentally wrong with the prompt, but it doesn’t spell out these testing constraints; the testcases are strict in subtle ways (minimal mock, exact exception type, byte content), so “defensive” additions that would be sensible in production backfired here. A minor oddity is that several responses duplicated the function definition, which isn’t fatal but signals generation noise.",Flawed/Incomplete Algorithm
BigCodeBench/1137,"The task is to extract phone numbers from a webpage or local file and save them in a JSON file. Across models, most failures stem from a simple mismatch with the test setup: every input is a local file passed as a file:// URL, while several models either treated it as a normal path or as an HTTP link, so they read nothing and returned empty lists (gpt-4o, llama-3-3, mistral-3-2) or even crashed on “invalid schema” (qwen3-coder). deepseek-v3 went further by reformatting numbers instead of returning the raw strings the tests expect, and also skipped writing the JSON output on error, which triggered missing-file assertions; sonnet-4’s code was incomplete and returned None. The tests are straightforward but strict: they require recognizing file://, preserving the exact +... numbers in order, and always writing the JSON file—even when no numbers are found. Nothing is wrong with the prompt or testcases, but the subtle “local file via URL” requirement and “no reformatting” expectation tripped most approaches.",Flawed/Incomplete Algorithm
BigCodeBench/120,"The task is to generate a pandas Series of random dates within a given date range, ensuring reproducibility with a seed and proper input validation. All six models—deepseek-v3, gpt-4o, llama-3-3, mistral-3-2, qwen3-coder, and sonnet-4—behaved similarly and failed for the same basic reason: they interpreted “inclusive range” as meaning the series should contain an inclusive number of days, while the tests expect a shorter series length (based on the gap between the dates) but still allow both endpoints as possible values. This off-by-one view cascaded into two visible breakages: the length check (e.g., 10 vs 9 days for a short range) and the exact reproducibility list, where each model produced one extra date compared with the expected sequence. The prompt and doc text contribute to the confusion: phrases like “including both start_date and end_date” and “length matches the number of days in the specified range” are ambiguous and nudge models toward the inclusive count, whereas the tests and canonical solution quietly require a different notion of length. Some responses also oddly duplicated the function (a stub followed by a full version), which is unusual but not the cause of failure. In short, a subtle spec–test mismatch about “inclusivity” led every model to the same mistaken approach and identical test failures.",Wrong Problem Mapping
BigCodeBench/124,"The task is to validate a list, append a value, generate random numbers based on its sum, and plot their histogram while returning the runtime and plot object. All six models broadly followed the task but failed the tests for the same core reason: they inferred from the prompt’s “number range (1–100) on the x-axis” that the histogram should span one bin per integer, while the hidden expectation in the tests (and canonical) was a 20-bin histogram, making the seeded bar heights not match; this ambiguity between the prose and the tests is the main source of failure. DeepSeek-V3, GPT-4o, Llama-3.3, Mistral-3.2, Qwen3-Coder, and Sonnet-4 all stumbled on this, producing many more bars than expected and thus mismatched frequencies. Several also tweaked the title text—Mistral-3.2 (“…(1–100)”), Qwen3-Coder and Sonnet-4 (“Distribution of Random Numbers”)—which violated an exact-string check. Mistral-3.2 additionally timed the wrong portion of the process (not penalized by tests), and some responses contained duplicate function stubs or stray lines (e.g., Llama-3.3), hinting at generation hygiene issues. Overall, the failures reflect a reasonable but incorrect reading of the prompt, compounded by strict, implicit test assumptions (20 bins, exact title) that weren’t explicitly stated.","Wrong Problem Mapping, Formatting Mistakes"
BigCodeBench/17,"The task is to check if a process with a given name is running, and either start it if not found or restart it if it is already running. All models struggled on this task because they failed to align with how the tests were written and what they were checking. A central issue was that the tests simulated processes in a way that only worked if the solution used one specific method of checking the process name, but most models (such as Deepseek-v3, GPT-4o, Llama-3-3, Mistral-3-2, Qwen3-coder, and Sonnet-4) relied on a different approach, so they consistently misdetected running processes and returned the wrong message. Several models also added extra arguments when starting processes (for example, using lists or enabling shell mode), which caused them to fail because the tests required an exact match. In some cases, like Llama-3-3 and Deepseek-v3, the models only stopped the first matching process instead of handling all instances, which the tests explicitly checked for. Overall, the failures were less about misunderstanding the task description and more about mismatches between the models’ coding habits and the strict expectations of the test setup.","Flawed/Incomplete Algorithm, Formatting Mistakes"
BigCodeBench/177,"The task is to filter articles by keywords in their titles and then count word frequencies from their content while excluding punctuation. All six models—deepseek-v3, gpt-4o, llama-3-3, mistral-3-2, qwen3-coder, and sonnet-4—fail for the same two high-level reasons: they normalize the article content to lowercase before counting words (merging “Data” with “data”, “What” with “what”), and they raise an error when the DataFrame is empty. Both choices clash with what the tests and the reference expect: counts must preserve original casing, and an empty but well-formed DataFrame should simply yield an empty result. The lowercasing is a reasonable “text-cleaning” instinct but contradicts the task’s evaluation; the empty-DataFrame error stems from a prompt/test mismatch—the prompt says to raise on emptiness, while the tests (and canonical solution) do not. A few stylistic quirks (e.g., deepseek-v3’s duplicate function, qwen3-coder/sonnet-4’s stricter title patterns) don’t drive the failures. In short, the models generally read the instruction like a generic NLP cleanup task, but the hidden grading criteria hinge on preserving case and treating an empty dataset as a valid no-op, and the prompt itself contributes to confusion by being inconsistent with the tests.",Wrong Problem Mapping
BigCodeBench/208,"The task is to generate a random walk of given length, plot it, and return its descriptive statistics. In this task, all models struggled with small but important mismatches against the strict test expectations, showing how sensitive the setup is. Deepseek-v3, GPT-4o, and Mistral-3-2 produced correct-looking results but calculated statistics slightly differently, leading to incorrect standard deviations and, in Deepseek and Mistral’s case, also adding extra words to the plot title. Llama-3-3 relied on default statistical summaries and missed required percentiles, while Qwen3-coder and Sonnet-4 both inserted an extra starting point in the random walk, making their plots and counts too long and causing repeated failures. Some models also used different naming for percentiles or altered titles, which the strict tests did not allow. Overall, the prompt itself was clear, but the tests required exact formatting and values, so even minor deviations in naming, counting, or statistical conventions caused failures across all models.","Flawed/Incomplete Algorithm, Formatting Mistakes"
BigCodeBench/211,"The task is to download a ZIP file from a given URL, save it, extract its contents into a target folder, and return the list of extracted files. All models failed for largely the same reason: they tried to be “helpful” by creating the destination folder, which—given the tests’ absolute path (/path/to/destination) and lack of mocking for directory creation—triggered permission errors before anything else could be validated. Beyond that shared pitfall, several models (e.g., deepseek-v3, gpt-4o, mistral-3-2, qwen3-coder, sonnet-4) ignored the required default request header and/or hard-coded a download filename, clashing with tests that strictly expect a specific header and a name derived from the URL; some (gpt-4o, llama-3-3, mistral-3-2) even removed the ZIP, contradicting the prompt’s “keep” instruction, while deepseek-v3 extracted from memory and never saved the file. The task and tests contain subtle traps: they mock most I/O but not directory creation, enforce exact call signatures, and implicitly require keeping the archive—small mismatches that, cumulatively, caused every approach to fail.","Flawed/Incomplete Algorithm, Formatting Mistakes"
BigCodeBench/214,"The task is to generate a random RGB image with given parameters and return both the image and its plot. All six models—deepseek-v3, gpt-4o, llama-3-3, mistral-3-2, qwen3-coder, and sonnet-4—generated valid-looking images with the right shapes, types, and error checks, yet they all failed because their random images didn’t match the test’s hard-coded expected pixels. The shared behavior that led to this was choosing a “sensible” vectorized NumPy approach to draw random values, while the hidden expectation (revealed by the tests and reference) was a very specific sequence tied to Python’s standard random generator; thus, even with the same seed, the numbers differ and the equality check explodes. Several models also emitted duplicate function definitions (first a stub with pass, then the “real” one), which is odd but not the root cause. Plotting choices (e.g., using or skipping cv2.cvtColor, calling plt.show()) didn’t matter. The deeper issue is with the test design and prompt: the prompt never states the exact randomness method required, but the tests demand an exact byte-for-byte image, making the task brittle and punishing reasonable alternative implementations like those from gpt-4o, llama-3-3, mistral-3-2, qwen3-coder, sonnet-4, and deepseek-v3.",Wrong Problem Mapping
BigCodeBench/227,"The task is to create a matrix from a list, normalize it using the sound pressure level of an audio file, and generate a spectrogram from it. All models failed primarily because they checked for the audio file’s existence in a way the tests didn’t mock—tests patch os.path.isfile, while the submissions (deepseek-v3, gpt-4o, llama-3-3, mistral-3-2, qwen3-coder, sonnet-4) mostly used a different existence check, so they incorrectly raised FileNotFoundError and never reached the core logic. Beyond that shared trigger, several approaches would still have stumbled: gpt-4o and mistral-3-2 normalized the matrix in ways that don’t match the SPL-based scaling the tests implicitly expect; qwen3-coder padded/truncated input instead of letting reshape fail (the tests expect an error for empty input); llama-3-3 and sonnet-4 drew spectrograms without calling librosa.display.specshow, which the tests explicitly check; and some responses included extra, duplicate, or demo code. The prompt itself is clear, but the test harness has strict, somewhat hidden contracts (use isfile, call specshow, let reshape raise) that the models violated, so the mismatch between test design and model choices is the real reason everything toppled.",Wrong Problem Mapping
BigCodeBench/241,"The task is to take a list of labeled numeric data, normalize the numeric values, and plot the original and normalized results together. All six models—deepseek-v3, gpt-4o, llama-3-3, mistral-3-2, qwen3-coder, and sonnet-4—failed for the same core reasons: they treated the input as a plain list of numbers instead of a list of (label, value) tuples, which made them try to process strings like “a” and crash; they chose MinMax scaling rather than the L2 normalization the tests expect; and none handled the empty-input case, which triggered errors. A couple of presentation mismatches would have also tripped tests later (mistral-3-2 and sonnet-4 used label text that doesn’t match what the tests look for). Some responses showed sloppy generation (duplicate function stubs; llama-3-3 even appended stray example code), suggesting the models weren’t tightly following constraints. The prompt likely contributed to the confusion: it says “normalize” without specifying which kind, and it pre-imports scikit-learn, nudging models toward MinMaxScaler; meanwhile, the tests quietly enforce L2 normalization and require unzipping the tuples, so the instructions and validation signals weren’t perfectly aligned.",Wrong Problem Mapping
